{
  "batch_id": "sb_16a6142633b2",
  "twin_id": "twin_ref_cafe_v1",
  "twin_version": 1,
  "robot_id": "bear_servi",
  "task": {
    "type": "delivery",
    "sequence": [
      "DOCK",
      "PICKUP",
      "T1",
      "T3",
      "T5",
      "DOCK"
    ]
  },
  "density": "quiet",
  "geometry_bound": "nominal",
  "n_episodes": 40,
  "seed_base": 1000,
  "code_version": "5e14e66+sim-d77ef3d9a1",
  "results": {
    "success_rate": 0.75,
    "min_gap_m": 0.03425,
    "ci95": [
      0.598057409330299,
      0.8581303210445048
    ],
    "median_mission_s": 89.1,
    "near_miss_per_mission": 0.425,
    "stops_per_mission": 1.175,
    "fail_reasons": {
      "no_path_static": 10,
      "blocked_timeout": 0,
      "collision": 0
    },
    "n_success": 30,
    "n_episodes": 40
  },
  "episodes_uri": null,
  "bottleneck_uri": null,
  "wall_time_s": 344.971
}