{
  "batch_id": "sb_3d1ce0160423",
  "twin_id": "twin_ref_cafe_v1",
  "twin_version": 1,
  "robot_id": "keenon_dinerbot_t9",
  "task": {
    "type": "delivery",
    "sequence": [
      "DOCK",
      "PICKUP",
      "T1",
      "T3",
      "T5",
      "DOCK"
    ]
  },
  "density": "quiet",
  "geometry_bound": "optimistic",
  "n_episodes": 40,
  "seed_base": 1000,
  "code_version": "5e14e66+sim-d77ef3d9a1",
  "results": {
    "success_rate": 0.575,
    "min_gap_m": 0.0347,
    "ci95": [
      0.42194800436059987,
      0.7149083147518411
    ],
    "median_mission_s": 103.1,
    "near_miss_per_mission": 0.4,
    "stops_per_mission": 1.0,
    "fail_reasons": {
      "no_path_static": 17,
      "blocked_timeout": 0,
      "collision": 0
    },
    "n_success": 23,
    "n_episodes": 40
  },
  "episodes_uri": null,
  "bottleneck_uri": null,
  "wall_time_s": 308.625
}