{
  "batch_id": "sb_194838a95e6c",
  "twin_id": "twin_ref_corridor_v1",
  "twin_version": 1,
  "robot_id": "pudu_kettybot",
  "task": {
    "type": "delivery",
    "sequence": [
      "DOCK",
      "PICKUP",
      "O4",
      "O3",
      "O2",
      "O1",
      "DOCK"
    ]
  },
  "density": "normal",
  "geometry_bound": "optimistic",
  "n_episodes": 40,
  "seed_base": 1000,
  "code_version": "f3a233c+sim-d77ef3d9a1",
  "results": {
    "success_rate": 0.925,
    "min_gap_m": 0.10655,
    "ci95": [
      0.8013546984090248,
      0.9741644432281419
    ],
    "median_mission_s": 67.6,
    "near_miss_per_mission": 3.45,
    "stops_per_mission": 4.925,
    "fail_reasons": {
      "no_path_static": 0,
      "blocked_timeout": 0,
      "collision": 3
    },
    "n_success": 37,
    "n_episodes": 40
  },
  "episodes_uri": null,
  "bottleneck_uri": null,
  "wall_time_s": 73.265
}