{
  "batch_id": "sb_1ff06d056f2c",
  "twin_id": "twin_ref_corridor_v1",
  "twin_version": 1,
  "robot_id": "keenon_dinerbot_t9",
  "task": {
    "type": "delivery",
    "sequence": [
      "DOCK",
      "PICKUP",
      "O4",
      "O3",
      "O2",
      "O1",
      "DOCK"
    ]
  },
  "density": "normal",
  "geometry_bound": "optimistic",
  "n_episodes": 40,
  "seed_base": 1000,
  "code_version": "5e14e66+sim-d77ef3d9a1",
  "results": {
    "success_rate": 0.95,
    "min_gap_m": 0.1185,
    "ci95": [
      0.834958291820748,
      0.9861796228538989
    ],
    "median_mission_s": 74.8,
    "near_miss_per_mission": 4.225,
    "stops_per_mission": 5.925,
    "fail_reasons": {
      "no_path_static": 0,
      "blocked_timeout": 0,
      "collision": 2
    },
    "n_success": 38,
    "n_episodes": 40
  },
  "episodes_uri": null,
  "bottleneck_uri": null,
  "wall_time_s": 62.808
}