{
  "batch_id": "sb_8a25748cc473",
  "twin_id": "twin_ref_corridor_v1",
  "twin_version": 1,
  "robot_id": "bear_servi",
  "task": {
    "type": "delivery",
    "sequence": [
      "DOCK",
      "PICKUP",
      "O4",
      "O3",
      "O2",
      "O1",
      "DOCK"
    ]
  },
  "density": "peak",
  "geometry_bound": "conservative",
  "n_episodes": 40,
  "seed_base": 1000,
  "code_version": "5e14e66+sim-d77ef3d9a1",
  "results": {
    "success_rate": 0.925,
    "min_gap_m": 0.10414999999999999,
    "ci95": [
      0.8013546984090248,
      0.9741644432281419
    ],
    "median_mission_s": 103.8,
    "near_miss_per_mission": 9.375,
    "stops_per_mission": 12.35,
    "fail_reasons": {
      "no_path_static": 0,
      "blocked_timeout": 1,
      "collision": 2
    },
    "n_success": 37,
    "n_episodes": 40
  },
  "episodes_uri": null,
  "bottleneck_uri": null,
  "wall_time_s": 86.205
}