{
  "batch_id": "sb_d885ee2a82ec",
  "twin_id": "twin_ref_cafe_v1",
  "twin_version": 1,
  "robot_id": "keenon_dinerbot_t8",
  "task": {
    "type": "delivery",
    "sequence": [
      "DOCK",
      "PICKUP",
      "T1",
      "T3",
      "T5",
      "DOCK"
    ]
  },
  "density": "peak",
  "geometry_bound": "conservative",
  "n_episodes": 40,
  "seed_base": 1000,
  "code_version": "f3a233c+sim-772a0fe9e8",
  "results": {
    "success_rate": 1.0,
    "min_gap_m": 0.02655,
    "ci95": [
      0.9123754607496077,
      1.0
    ],
    "median_mission_s": 121.15,
    "near_miss_per_mission": 3.9,
    "stops_per_mission": 7.2,
    "fail_reasons": {
      "no_path_static": 0,
      "blocked_timeout": 0,
      "collision": 0
    },
    "n_success": 40,
    "n_episodes": 40
  },
  "episodes_uri": null,
  "bottleneck_uri": null,
  "wall_time_s": 156.626
}