{
  "batch_id": "sb_66564fd490c1",
  "twin_id": "twin_ref_storeroom_v1",
  "twin_version": 1,
  "robot_id": "mir_mir100",
  "task": {
    "type": "delivery",
    "sequence": [
      "DOCK",
      "PICKUP",
      "S1",
      "S2",
      "S3",
      "S4",
      "DOCK"
    ]
  },
  "density": "quiet",
  "geometry_bound": "nominal",
  "n_episodes": 40,
  "seed_base": 1000,
  "code_version": "5e14e66+sim-d77ef3d9a1",
  "results": {
    "success_rate": 0.875,
    "min_gap_m": 0.0275,
    "ci95": [
      0.7388757932976187,
      0.9454058022645873
    ],
    "median_mission_s": 144.7,
    "near_miss_per_mission": 0.75,
    "stops_per_mission": 1.225,
    "fail_reasons": {
      "no_path_static": 5,
      "blocked_timeout": 0,
      "collision": 0
    },
    "n_success": 35,
    "n_episodes": 40
  },
  "episodes_uri": null,
  "bottleneck_uri": null,
  "wall_time_s": 202.991
}