{
  "batch_id": "sb_a6ff401274e6",
  "twin_id": "twin_ref_corridor_v1",
  "twin_version": 1,
  "robot_id": "keenon_w3",
  "task": {
    "type": "delivery",
    "sequence": [
      "DOCK",
      "PICKUP",
      "O4",
      "O3",
      "O2",
      "O1",
      "DOCK"
    ]
  },
  "density": "peak",
  "geometry_bound": "nominal",
  "n_episodes": 40,
  "seed_base": 1000,
  "code_version": "f3a233c+sim-d77ef3d9a1",
  "results": {
    "success_rate": 1.0,
    "min_gap_m": 0.10915,
    "ci95": [
      0.9123754607496077,
      1.0
    ],
    "median_mission_s": 112.25,
    "near_miss_per_mission": 11.825,
    "stops_per_mission": 15.2,
    "fail_reasons": {
      "no_path_static": 0,
      "blocked_timeout": 0,
      "collision": 0
    },
    "n_success": 40,
    "n_episodes": 40
  },
  "episodes_uri": null,
  "bottleneck_uri": null,
  "wall_time_s": 391.618
}